Symbol,Sector,Companyname,Marketcap,Lastsaleprice,Netchange,Percentagechange,Deltaindicator
NVDA,,NVIDIA Corporation Common Stock,3904000000000,$160.30,$2.06,+1.30%,up
MSFT,,Microsoft Corporation Common Stock,3691149934236,$497.00,$0.72,-0.14%,down
AAPL,,Apple Inc. Common Stock,3136672818260,$210.1606,$0.2106,+0.10%,up
AMZN,,"Amazon.com, Inc. Common Stock",2328803064000,$219.69,$3.78,-1.69%,down
GOOG,,Alphabet Inc. Class C Capital Stock,2125566600000,$175.44,$2.12,-1.19%,down
GOOGL,,Alphabet Inc. Class A Common Stock,2115858600000,$174.60,$2.19,-1.24%,down
META,,"Meta Platforms, Inc. Class A Common Stock",1812000218537,$720.98,$2.63,+0.37%,up
AVGO,,Broadcom Inc. Common Stock,1278403412092,$271.90,$2.28,-0.83%,down
TSLA,,"Tesla, Inc. Common Stock",959232969198,$297.64,$3.70,+1.26%,up
NFLX,,"Netflix, Inc. Common Stock",542878054545,"$1,269.34",$20.28,-1.57%,down
COST,,Costco Wholesale Corporation Common Stock,437197450462,$986.4999,$5.6801,-0.57%,down
PLTR,,Palantir Technologies Inc. Class A Common Stock,329703360985,$139.3393,$0.2193,+0.16%,up
ASML,,ASML Holding N.V. New York Registry Shares,312306602052,$791.00,$5.91,+0.75%,up
CSCO,,"Cisco Systems, Inc. Common Stock (DE)",271616275166,$68.6188,$0.3112,-0.45%,down
TMUS,,"T-Mobile US, Inc. Common Stock",267930982135,$236.00,$1.63,-0.69%,down
AMD,,"Advanced Micro Devices, Inc. Common Stock",223461926155,$138.27,$3.47,+2.57%,up
LIN,,Linde plc Ordinary Shares,221484711640,$469.95,$0.36,+0.08%,up
INTU,,Intuit Inc. Common Stock,217991501560,$788.0588,$4.4488,+0.57%,up
AZN,,AstraZeneca PLC American Depositary Shares,217154140998,$70.61,$0.98,+1.41%,up
TXN,,Texas Instruments Incorporated Common Stock,196802306474,$216.63,$3.22,+1.51%,up
ISRG,,"Intuitive Surgical, Inc. Common Stock",188993945862,$528.30,$6.41,-1.20%,down
BKNG,,Booking Holdings Inc. Common Stock,185913689306,"$5,712.13",$103.79,-1.78%,down
PEP,,"PepsiCo, Inc. Common Stock",185150581082,$135.15,$0.70,+0.52%,up
QCOM,,QUALCOMM Incorporated Common Stock,175076100000,$159.5999,$1.5099,+0.96%,up
ADBE,,Adobe Inc. Common Stock,162146208000,$382.50,$5.57,+1.48%,up
AMGN,,Amgen Inc. Common Stock,159698717046,$294.05,$1.10,+0.38%,up
ARM,,Arm Holdings plc American Depositary Shares,156548626412,$148.16,$1.28,+0.87%,up
AMAT,,"Applied Materials, Inc. Common Stock",156479127333,$195.31,$4.53,+2.37%,up
HON,,Honeywell International Inc. Common Stock,154115361578,$240.10,$0.75,+0.31%,up
PDD,,PDD Holdings Inc. American Depositary Shares,150922615375,$106.3799,$1.1299,+1.07%,up
SHOP,,Shopify Inc. Class A Subordinate Voting Shares,145929400370,$112.7188,$3.9412,-3.38%,down
MU,,"Micron Technology, Inc. Common Stock",139241545066,$124.84,$4.92,+4.10%,up
GILD,,"Gilead Sciences, Inc. Common Stock",138150768178,$111.95,$0.17,+0.15%,up
PANW,,"Palo Alto Networks, Inc. Common Stock",136020532000,$203.85,$2.43,+1.21%,up
CMCSA,,Comcast Corporation Class A Common Stock,134413341372,$36.10,$0.66,+1.86%,up
LRCX,,Lam Research Corporation Common Stock,127694349940,$99.97,$1.83,+1.86%,up
CRWD,,"CrowdStrike Holdings, Inc. Class A Common Stock",126545790422,$507.174,$1.714,+0.34%,up
MELI,,"MercadoLibre, Inc. Common Stock",125557118925,"$2,476.00",$25.08,-1.00%,down
ADP,,"Automatic Data Processing, Inc. Common Stock",124577691668,$306.18,$2.22,-0.72%,down
ADI,,"Analog Devices, Inc. Common Stock",121655245249,$245.15,$3.34,+1.38%,up
KLAC,,KLA Corporation Common Stock,121558967285,$922.00,$9.38,+1.03%,up
VRTX,,Vertex Pharmaceuticals Incorporated Common Stock,119759936129,$465.00,$5.59,+1.22%,up
APP,,Applovin Corporation Class A Common Stock,116658869985,$345.00,UNCH,UNCH,unch
MSTR,,MicroStrategy Incorporated Common Stock Class A,110882049602,$396.98,$1.31,+0.33%,up
SBUX,,Starbucks Corporation Common Stock,107889816000,$95.38,$1.74,+1.86%,up
INTC,,Intel Corporation Common Stock,102899580000,$23.60,$1.60,+7.27%,up
DASH,,"DoorDash, Inc. Class A Common Stock",102321493864,$241.60,$5.29,-2.14%,down
CEG,,Constellation Energy Corporation Common Stock ,98049490031,$314.00,$4.25,-1.34%,down
MDLZ,,"Mondelez International, Inc. Class A Common Stock",88293460285,$67.90,$0.92,-1.34%,down
CDNS,,"Cadence Design Systems, Inc. Common Stock",88269017760,$320.20,$0.10,-0.03%,down
CTAS,,Cintas Corporation Common Stock,86931295264,$215.00,$2.54,-1.17%,down
ABNB,,"Airbnb, Inc. Class A Common Stock",85812283307,$136.99,$0.01,-0.01%,down
SNPS,,"Synopsys, Inc. Common Stock",85572808916,$551.20,$14.68,+2.74%,up
FTNT,,"Fortinet, Inc. Common Stock",82312885678,$107.80,$1.15,+1.08%,up
ORLY,,"O'Reilly Automotive, Inc. Common Stock",78337313174,$91.50,$1.17,-1.26%,down
MAR,,Marriott International Class A Common Stock,76679957475,$279.50,$1.10,+0.40%,up
PYPL,,"PayPal Holdings, Inc. Common Stock",72969138160,$75.20,$0.98,-1.29%,down
ADSK,,"Autodesk, Inc. Common Stock",67390740000,$311.1801,$4.1299,-1.31%,down
WDAY,,"Workday, Inc. Class A Common Stock",64205490000,$240.47,$0.74,-0.31%,down
CSX,,CSX Corporation Common Stock,62724646633,$33.5899,$0.5399,+1.63%,up
MRVL,,"Marvell Technology, Inc. Common Stock",62035290000,$72.40,$0.85,+1.19%,up
AXON,,"Axon Enterprise, Inc. Common Stock",61519268659,$790.20,$11.96,-1.49%,down
ROP,,"Roper Technologies, Inc. Common Stock",60702117992,$569.18,$4.005,+0.71%,up
MNST,,Monster Beverage Corporation,60065410933,$62.37,$0.48,-0.76%,down
REGN,,"Regeneron Pharmaceuticals, Inc. Common Stock",59138100982,$547.76,$9.65,+1.79%,up
NXPI,,NXP Semiconductors N.V. Common Stock,58695751693,$232.70,$6.70,+2.96%,up
CHTR,,"Charter Communications, Inc. Class A Common Stock New",57782337687,$410.11,$1.79,+0.44%,up
TEAM,,Atlassian Corporation Class A Common Stock,57583280404,$219.10,$3.05,+1.41%,up
AEP,,"American Electric Power Company, Inc. Common Stock",55534914903,$104.12,$0.05,-0.05%,down
PAYX,,"Paychex, Inc. Common Stock",52195229700,$144.37,$1.30,-0.89%,down
PCAR,,PACCAR Inc. Common Stock,51813495248,$98.70,$2.06,+2.13%,up
DDOG,,"Datadog, Inc. Class A Common Stock",50400850532,$146.4999,$5.9101,-3.88%,down
FAST,,Fastenal Company Common Stock,49147816264,$42.50,$0.03,+0.07%,up
ZS,,"Zscaler, Inc. Common Stock",48645555760,$313.01,$2.44,-0.77%,down
CPRT,,"Copart, Inc. (DE) Common Stock",46906075741,$48.91,$0.08,+0.16%,up
KDP,,Keurig Dr Pepper Inc. Common Stock,46218799688,$33.92,$0.14,+0.41%,up
CCEP,,Coca-Cola Europacific Partners plc Ordinary Shares,43987171488,$94.83,$1.99,-2.06%,down
EXC,,Exelon Corporation Common Stock,43410033552,$43.11,$0.06,-0.14%,down
IDXX,,"IDEXX Laboratories, Inc. Common Stock",43334143647,$537.00,$8.56,-1.57%,down
ROST,,"Ross Stores, Inc. Common Stock",43029397743,$131.90,$1.13,+0.86%,up
TTWO,,"Take-Two Interactive Software, Inc. Common Stock",42681335868,$241.37,$1.16,-0.48%,down
VRSK,,"Verisk Analytics, Inc. Common Stock",42320528656,$300.53,$7.64,-2.48%,down
FANG,,"Diamondback Energy, Inc. Common Stock",42002065930,$143.40,$5.48,+3.97%,up
MCHP,,Microchip Technology Incorporated Common Stock,40217622694,$74.70,$3.22,+4.50%,up
CTSH,,Cognizant Technology Solutions Corporation Class A Common Stock,39785345834,$80.22,$0.24,-0.30%,down
BKR,,Baker Hughes Company Class A Common Stock,39738981497,$40.2733,$1.1833,+3.03%,up
XEL,,Xcel Energy Inc. Common Stock,38965947014,$67.94,$0.06,+0.09%,up
EA,,Electronic Arts Inc. Common Stock,38276917966,$152.15,$1.38,-0.90%,down
TTD,,"The Trade Desk, Inc. Class A Common Stock",36381204666,$73.84,$0.28,+0.38%,up
ODFL,,"Old Dominion Freight Line, Inc. Common Stock",35371644448,$168.12,$3.81,+2.32%,up
CSGP,,"CoStar Group, Inc. Common Stock",34944871468,$83.31,$1.71,+2.10%,up
GEHC,,GE HealthCare Technologies Inc. Common Stock ,34432951850,$76.34,$1.73,+2.32%,up
DXCM,,"DexCom, Inc. Common Stock",32842924284,$83.76,$0.82,+0.99%,up
ANSS,,"ANSYS, Inc. Common Stock",32256432867,$366.90,$3.81,+1.05%,up
KHC,,The Kraft Heinz Company Common Stock,31281017729,$26.50,$0.42,+1.61%,up
WBD,,"Warner Bros. Discovery, Inc. Series A Common Stock ",28229195784,$11.4099,$0.3899,+3.54%,up
LULU,,lululemon athletica inc. Common Stock,27367558232,$238.01,$0.44,+0.19%,up
ON,,ON Semiconductor Corporation Common Stock,24076464210,$57.6292,$3.0192,+5.53%,up
CDW,,CDW Corporation Common Stock,23788922348,$182.94,$5.58,+3.15%,up
GFS,,GlobalFoundries Inc. Ordinary Shares,23034348206,$42.00,$3.05,+7.83%,up
BIIB,,Biogen Inc. Common Stock,19702132291,$134.52,$4.39,+3.37%,up
